[
  {
    "id": "N-ANSOR-003",
    "reviewer": "verification-agent-4",
    "round": "round2",
    "independentAnswer": ["A", "B"],
    "officialAnswer": ["A", "B"],
    "answerAgreement": true,
    "uniqueAnswerConfidence": "high",
    "uniqueAnswer": true,
    "sourceSupported": true,
    "hardwareConditionsSufficient": true,
    "versionScopeSufficient": true,
    "openBlocker": false,
    "openMajor": false,
    "issues": [],
    "overallResult": "PASS",
    "verificationResult": "PASS"
  },
  {
    "id": "N-FLASH-006",
    "reviewer": "verification-agent-4",
    "round": "round2",
    "independentAnswer": ["A", "C", "D"],
    "officialAnswer": ["A", "C", "D"],
    "answerAgreement": true,
    "uniqueAnswerConfidence": "high",
    "uniqueAnswer": true,
    "sourceSupported": true,
    "hardwareConditionsSufficient": true,
    "versionScopeSufficient": true,
    "openBlocker": false,
    "openMajor": false,
    "issues": [
      {
        "level": "MINOR",
        "type": "scope",
        "note": "Verified: softwareContext.framework='FlashAttention (v1)' is explicit; stem also says 'FlashAttention (v1)'. Content card canonicalClaims correctly refute option B (paper does NOT store N×N; backward recomputes from statistics). Speedup claim is scoped as 'largest in memory-bound regime' with performanceClaim.hardwareDependent=true. Kernel-level vs e2e distinction is handled (option A is about kernel-level speedup vs a naive kernel, not e2e). Round 1's stylistic suggestion (add FlashAttention-2 nonImplication) is a nice-to-have; non-blocking."
      }
    ],
    "overallResult": "PASS",
    "verificationResult": "PASS"
  },
  {
    "id": "N-GSPMD-008",
    "reviewer": "verification-agent-4",
    "round": "round2",
    "independentAnswer": ["B", "C"],
    "officialAnswer": ["B", "C"],
    "answerAgreement": true,
    "uniqueAnswerConfidence": "high",
    "uniqueAnswer": true,
    "sourceSupported": true,
    "hardwareConditionsSufficient": true,
    "versionScopeSufficient": true,
    "openBlocker": false,
    "openMajor": false,
    "issues": [],
    "overallResult": "PASS",
    "verificationResult": "PASS"
  },
  {
    "id": "N-HALIDE-001",
    "reviewer": "verification-agent-4",
    "round": "round2",
    "independentAnswer": ["C"],
    "officialAnswer": ["C"],
    "answerAgreement": true,
    "uniqueAnswerConfidence": "high",
    "uniqueAnswer": true,
    "sourceSupported": true,
    "hardwareConditionsSufficient": true,
    "versionScopeSufficient": true,
    "openBlocker": false,
    "openMajor": false,
    "issues": [],
    "overallResult": "PASS",
    "verificationResult": "PASS"
  },
  {
    "id": "N-MLIR-004",
    "reviewer": "verification-agent-4",
    "round": "round2",
    "independentAnswer": ["C"],
    "officialAnswer": ["C"],
    "answerAgreement": true,
    "uniqueAnswerConfidence": "high",
    "uniqueAnswer": true,
    "sourceSupported": true,
    "hardwareConditionsSufficient": true,
    "versionScopeSufficient": true,
    "openBlocker": false,
    "openMajor": false,
    "issues": [],
    "overallResult": "PASS",
    "verificationResult": "PASS"
  },
  {
    "id": "N-PYT2-009",
    "reviewer": "verification-agent-4",
    "round": "round2",
    "independentAnswer": ["C"],
    "officialAnswer": ["C"],
    "answerAgreement": true,
    "uniqueAnswerConfidence": "high",
    "uniqueAnswer": true,
    "sourceSupported": true,
    "hardwareConditionsSufficient": true,
    "versionScopeSufficient": true,
    "openBlocker": false,
    "openMajor": false,
    "issues": [
      {
        "level": "MINOR",
        "type": "version-scope",
        "note": "Verified: softwareContext.stability='version_sensitive' with frameworkVersionScope='PyTorch 2.x as reported in the paper' and verifiedAt='2026-07-26'. The tested principle (Amdahl bound on kernel vs e2e speedup) is version-stable; the version_sensitive label is defensive and appropriate. Kernel-level vs e2e distinction is exactly what this question tests — no risk of the reverse error."
      }
    ],
    "overallResult": "PASS",
    "verificationResult": "PASS"
  },
  {
    "id": "N-QUANT-010",
    "reviewer": "verification-agent-4",
    "round": "round2",
    "independentAnswer": ["A", "C", "D"],
    "officialAnswer": ["A", "C", "D"],
    "answerAgreement": true,
    "uniqueAnswerConfidence": "high",
    "uniqueAnswer": true,
    "sourceSupported": true,
    "hardwareConditionsSufficient": true,
    "versionScopeSufficient": true,
    "openBlocker": false,
    "openMajor": false,
    "issues": [
      {
        "level": "MINOR",
        "type": "scope",
        "note": "Verified: this is the module's paper-scope-discipline question. Option B is a canonical overclaim (universal ≥3× e2e from 4-bit) and is correctly rejected. sourceRefs cover all three papers (SmoothQuant, GPTQ, AWQ) with locators pointing at the evaluation sections that support the scope-limit claims. Distinguishing memory footprint reduction (universal) from wall-clock speedup (kernel/HW-dependent) is done in option D."
      }
    ],
    "overallResult": "PASS",
    "verificationResult": "PASS"
  },
  {
    "id": "N-TRITON-005",
    "reviewer": "verification-agent-4",
    "round": "round2",
    "independentAnswer": ["D"],
    "officialAnswer": ["D"],
    "answerAgreement": true,
    "uniqueAnswerConfidence": "high",
    "uniqueAnswer": true,
    "sourceSupported": true,
    "hardwareConditionsSufficient": true,
    "versionScopeSufficient": true,
    "openBlocker": false,
    "openMajor": false,
    "issues": [],
    "overallResult": "PASS",
    "verificationResult": "PASS"
  },
  {
    "id": "N-TVM-002",
    "reviewer": "verification-agent-4",
    "round": "round2",
    "independentAnswer": ["B"],
    "officialAnswer": ["B"],
    "answerAgreement": true,
    "uniqueAnswerConfidence": "high",
    "uniqueAnswer": true,
    "sourceSupported": true,
    "hardwareConditionsSufficient": true,
    "versionScopeSufficient": true,
    "openBlocker": false,
    "openMajor": false,
    "issues": [],
    "overallResult": "PASS",
    "verificationResult": "PASS"
  },
  {
    "id": "N-VLLM-007",
    "reviewer": "verification-agent-4",
    "round": "round2",
    "independentAnswer": ["A"],
    "officialAnswer": ["A"],
    "answerAgreement": true,
    "uniqueAnswerConfidence": "high",
    "uniqueAnswer": true,
    "sourceSupported": true,
    "hardwareConditionsSufficient": true,
    "versionScopeSufficient": true,
    "openBlocker": false,
    "openMajor": false,
    "issues": [],
    "overallResult": "PASS",
    "verificationResult": "PASS"
  }
]
